{
  "entity": "clients",
  "version": 1,
  "maskData": false,
  "permissions": {
    "edit": [
      "admin",
      "manager",
      "IT_SUPPORT"
    ]
  },
  "tabs": [
    {
      "id": "general",
      "flatData": true,
      "label": {
        "en": "General"
      },
      "fields": [
        {
          "id": "name",
          "type": "text",
          "label": {
            "en": "Name"
          },
          "validators": {
            "required": true
          },
          "visibility": true
        },
        {
          "id": "email",
          "type": "email",
          "label": {
            "en": "Email"
          },
          "hint": {
            "en": "We use this for billing notices — a shared inbox is fine."
          },
          "validators": {
            "pattern": "^[a-zA-Z0-9._%+-]+@[a-zA-Z0-9.-]+\\.[a-zA-Z]{2,}$"
          },
          "visibility": true
        },
        {
          "id": "company",
          "type": "text",
          "label": {
            "en": "Company"
          },
          "hint": {
            "en": "The registered legal name, not the trading name."
          },
          "visibility": true
        },
        {
          "id": "website",
          "type": "url",
          "label": {
            "en": "Website"
          },
          "validators": {
            "url": true
          },
          "visibility": true
        },
        {
          "id": "phone",
          "type": "phone",
          "label": {
            "en": "Phone"
          },
          "hint": {
            "en": "Include the country code if the client is abroad."
          },
          "validators": {
            "phone": true
          },
          "visibility": true
        },
        {
          "id": "status",
          "type": "dropdown",
          "label": {
            "en": "Status"
          },
          "options": [
            {
              "en": "Active"
            },
            {
              "en": "Inactive"
            }
          ],
          "visibility": true
        },
        {
          "id": "tier",
          "type": "dropdown",
          "label": {
            "en": "Tier"
          },
          "listName": "clientTier",
          "visibility": true
        },
        {
          "id": "salary",
          "type": "number",
          "label": {
            "en": "Salary"
          },
          "colSpan": 6,
          "visibility": true,
          "maskData": true
        },
        {
          "id": "brandColor",
          "type": "color",
          "label": {
            "en": "Brand colour"
          },
          "visibility": true
        },
        {
          "id": "labels",
          "type": "tags",
          "label": {
            "en": "Labels"
          },
          "validators": {
            "maxLength": 8
          },
          "visibility": true
        },
        {
          "id": "notes",
          "type": "textarea",
          "label": {
            "en": "Notes"
          },
          "visibility": true
        }
      ]
    },
    {
      "id": "documentsTab",
      "label": {
        "en": "Documents"
      },
      "moduleName": "documents-view"
    }
  ]
}
